{
  "schema_version": "prophage-source-semantics-v1",
  "policy_id": "prophage-coordinate-policy-v1",
  "source_sha256": "6c8e3df4fce6bfa1119a594f83b758bd4ce097a22d9ee25289fdf2fbcb362996",
  "source_rows": 132404,
  "normalization": {
    "lossless": true,
    "raw_row_identity": "sha256(source_file_sha256 || physical_csv_record_number || exact_record_bytes)",
    "raw_fields": ["end", "genome", "scaffold", "begin", "transposable", "taxonomy", "prophage_id"],
    "reversible": true,
    "rule": "retain exact source bytes, physical record number, every raw field string, parsed integer sensitivity values, and policy version; no row is removed or rewritten"
  },
  "scopes": [
    {
      "id": "all_records",
      "rule": "every source data row",
      "source_defined": false,
      "rows": 132404,
      "generic_tagged_alias": false
    },
    {
      "id": "transposable_flag_positive",
      "rule": "Decimal(raw transposable) == Decimal(1); observed raw member value is exactly 1.0",
      "source_defined": false,
      "rows": 7695,
      "generic_tagged_alias": false
    },
    {
      "id": "taxonomy_assigned",
      "rule": "trimmed case-folded raw taxonomy is neither empty nor Unknown",
      "source_defined": false,
      "rows": 115442,
      "generic_tagged_alias": false
    }
  ],
  "semantic_dimensions": [
    {
      "name": "producer_and_caller_version",
      "status": "UNRESOLVED",
      "confidence": "NONE",
      "value": null,
      "evidence_ids": ["SOURCE_CSV_IMMUTABLE", "PHIGARO_230_HEADER_AND_COORDS", "PHIGARO_240_COORDINATE_CHANGE"],
      "extraction_critical": true
    },
    {
      "name": "tagged",
      "status": "UNRESOLVED",
      "confidence": "NONE",
      "value": "unresolved user/source term; no generic tagged scope exists",
      "evidence_ids": ["SOURCE_CSV_IMMUTABLE", "SOURCE_AUDIT", "INTEGRATED_PLAN"],
      "extraction_critical": false
    },
    {
      "name": "transposable",
      "status": "HYPOTHESIS_NOT_ATTRIBUTABLE",
      "confidence": "LOW",
      "value": "raw binary source field; Phigaro v2.3 candidate algorithm detects a pattern of Integration-group pVOG annotations, not completeness/quality",
      "evidence_ids": ["SOURCE_CSV_IMMUTABLE", "PHIGARO_230_TRANSPOSABLE"],
      "extraction_critical": false
    },
    {
      "name": "taxonomy_labels",
      "status": "HYPOTHESIS_NOT_ATTRIBUTABLE",
      "confidence": "LOW",
      "value": "raw class-like strings only; Phigaro v2.3 candidate produces tied modal pVOG taxonomy codes and Unknown when none map",
      "evidence_ids": ["SOURCE_CSV_IMMUTABLE", "PHIGARO_230_TAXONOMY"],
      "extraction_critical": false
    },
    {
      "name": "coordinate_base_and_end_inclusivity",
      "status": "UNRESOLVED",
      "confidence": "NONE",
      "value": null,
      "evidence_ids": ["SOURCE_CSV_IMMUTABLE", "PHIGARO_230_HEADER_AND_COORDS", "PHIGARO_240_COORDINATE_CHANGE", "N10_ANNOTATION_BOUNDARY_DIAGNOSTIC"],
      "extraction_critical": true
    },
    {
      "name": "strand_orientation",
      "status": "ABSENT_UNKNOWN",
      "confidence": "HIGH",
      "value": "unknown; forward genomic spelling only after coordinate resolution; never infer strand",
      "evidence_ids": ["SOURCE_CSV_IMMUTABLE", "INTEGRATED_PLAN"],
      "extraction_critical": true
    },
    {
      "name": "topology_and_circularity",
      "status": "UNRESOLVED",
      "confidence": "NONE",
      "value": "source has no topology, origin-wrap, or ordered-interval marker; do not infer from begin<=end",
      "evidence_ids": ["SOURCE_CSV_IMMUTABLE", "INTEGRATED_PLAN", "CANONICAL_COHORT_010"],
      "extraction_critical": true
    },
    {
      "name": "contig_edge_behavior",
      "status": "UNRESOLVED",
      "confidence": "NONE",
      "value": "source does not declare clipping, extension, truncation, or edge callability",
      "evidence_ids": ["SOURCE_CSV_IMMUTABLE", "SOURCE_AUDIT", "INTEGRATED_PLAN"],
      "extraction_critical": true
    },
    {
      "name": "completeness",
      "status": "ABSENT_UNKNOWN",
      "confidence": "HIGH",
      "value": "no source completeness field; edge and length diagnostics are not completeness labels",
      "evidence_ids": ["SOURCE_CSV_IMMUTABLE", "SOURCE_AUDIT"],
      "extraction_critical": false
    },
    {
      "name": "duplicate_locus_rules",
      "status": "UNRESOLVED",
      "confidence": "NONE",
      "value": "producer handling unknown; this snapshot has zero duplicate (genome,scaffold,begin,end) groups and policy preserves every row without deduplication",
      "evidence_ids": ["SOURCE_AUDIT"],
      "extraction_critical": true
    }
  ],
  "coordinate_candidates": [
    {
      "id": "C1_RAW_1_BASED_CLOSED",
      "source_convention": "raw [begin,end] is 1-based closed",
      "canonical_transform": "[begin-1,end) in 0-based half-open coordinates",
      "status": "CANDIDATE",
      "test_plan": [
        "obtain digest-pinned producer/caller version and exact post-processing provenance",
        "verify version-matched native TSV against native BED/GFF and saved FASTA on a declared known-base fixture",
        "for each frozen sentinel assert first/last expected base, length=end-begin+1, whole-slice digest, contig bounds, edge/wrap state",
        "require independent exact-source/canonical base round-trip before selection"
      ]
    },
    {
      "id": "C2_RAW_0_BASED_INCLUSIVE",
      "source_convention": "raw [begin,end] is 0-based inclusive",
      "canonical_transform": "[begin,end+1) in 0-based half-open coordinates",
      "status": "CANDIDATE",
      "test_plan": [
        "obtain digest-pinned producer/caller version and exact post-processing provenance",
        "verify version-matched native TSV against native BED/GFF and saved FASTA on a declared known-base fixture",
        "for each frozen sentinel assert first/last expected base, length=end-begin+1, whole-slice digest, contig bounds, edge/wrap state",
        "require independent exact-source/canonical base round-trip before selection"
      ]
    }
  ],
  "extraction_gate": {
    "verdict": "EXTRACTION_BLOCKED",
    "consumer_action": "REJECT",
    "blocking_dimensions": [
      "producer_and_caller_version",
      "coordinate_base_and_end_inclusivity",
      "strand_orientation",
      "topology_and_circularity",
      "contig_edge_behavior",
      "duplicate_locus_rules"
    ],
    "release_rule": "A consumer must require verdict == EXTRACTION_GO and must reject missing, unknown, CONDITIONAL, or EXTRACTION_BLOCKED."
  }
}
